{
  "$schema": "./agent-harness/schemas/feature-list.schema.json",
  "schema_version": 1,
  "project": {
    "name": "stardew-valley-clone",
    "summary": "A cozy farming RPG vertical slice built with React, Vite, and Phaser.",
    "issue_tracker": "github",
    "repository": "https://github.com/carlomigueldy/stardew-valley-clone"
  },
  "status_values": [
    "planned",
    "ready",
    "in-progress",
    "blocked",
    "done"
  ],
  "epics": [
    {
      "id": "EPIC-FOUNDATION",
      "title": "Foundation and delivery harness",
      "status": "done",
      "labels": [
        "epic",
        "foundation"
      ],
      "github_issue": {
        "number": 1,
        "url": "https://github.com/carlomigueldy/stardew-valley-clone/issues/1",
        "state": "open"
      },
      "description": "Create the project delivery frame, quality gates, deployment config, and contributor workflow.",
      "sub_issues": [
        {
          "id": "FOUND-001",
          "title": "Bootstrap React, Vite, and Phaser app shell",
          "type": "feature",
          "status": "done",
          "labels": [
            "foundation",
            "app-shell"
          ],
          "github_issue": {
            "number": 2,
            "url": "https://github.com/carlomigueldy/stardew-valley-clone/issues/2",
            "state": "open"
          },
          "depends_on": [],
          "paths_allowed": [
            "src/**",
            "index.html",
            "package.json",
            "vite.config.*",
            "tsconfig*.json"
          ],
          "acceptance_criteria": [
            "Vite dev server starts without runtime errors.",
            "React mounts a Phaser game canvas.",
            "Build output is produced in dist/."
          ]
        },
        {
          "id": "FOUND-002",
          "title": "Install delivery quality gates",
          "type": "task",
          "status": "done",
          "labels": [
            "foundation",
            "quality"
          ],
          "github_issue": {
            "number": 3,
            "url": "https://github.com/carlomigueldy/stardew-valley-clone/issues/3",
            "state": "open"
          },
          "depends_on": [],
          "paths_allowed": [
            "scripts/**",
            ".github/**",
            "agent-harness/**",
            "feature_list.json"
          ],
          "acceptance_criteria": [
            "Feature list validation passes.",
            "Attribution guard can run locally and in CI.",
            "Pull requests include a repeatable quality checklist."
          ]
        }
      ]
    },
    {
      "id": "EPIC-GAME-LOOP",
      "title": "Playable day loop",
      "status": "done",
      "labels": [
        "epic",
        "gameplay"
      ],
      "github_issue": {
        "number": 4,
        "url": "https://github.com/carlomigueldy/stardew-valley-clone/issues/4",
        "state": "open"
      },
      "description": "Deliver the first minute-to-minute loop for moving, time passing, and interacting with the farm.",
      "sub_issues": [
        {
          "id": "LOOP-001",
          "title": "Top-down player movement and camera follow",
          "type": "feature",
          "status": "done",
          "labels": [
            "gameplay",
            "movement"
          ],
          "github_issue": {
            "number": 5,
            "url": "https://github.com/carlomigueldy/stardew-valley-clone/issues/5",
            "state": "open"
          },
          "depends_on": [
            "FOUND-001"
          ],
          "paths_allowed": [
            "src/**"
          ],
          "acceptance_criteria": [
            "Player moves in four directions with keyboard input.",
            "Camera follows the player inside world bounds.",
            "Movement speed is configurable."
          ]
        },
        {
          "id": "LOOP-002",
          "title": "Game clock and day transition",
          "type": "feature",
          "status": "done",
          "labels": [
            "gameplay",
            "time"
          ],
          "github_issue": {
            "number": 6,
            "url": "https://github.com/carlomigueldy/stardew-valley-clone/issues/6",
            "state": "open"
          },
          "depends_on": [
            "FOUND-001"
          ],
          "paths_allowed": [
            "src/**"
          ],
          "acceptance_criteria": [
            "Clock advances while the scene is active.",
            "A visible HUD shows day and time.",
            "Day transition resets time and advances persistent day count."
          ]
        }
      ]
    },
    {
      "id": "EPIC-FARMING",
      "title": "Core farming interactions",
      "status": "done",
      "labels": [
        "epic",
        "farming"
      ],
      "github_issue": {
        "number": 7,
        "url": "https://github.com/carlomigueldy/stardew-valley-clone/issues/7",
        "state": "open"
      },
      "description": "Support tilling, planting, watering, crop growth, and harvesting.",
      "sub_issues": [
        {
          "id": "FARM-001",
          "title": "Tile interaction model",
          "type": "feature",
          "status": "done",
          "labels": [
            "farming",
            "tiles"
          ],
          "github_issue": {
            "number": 8,
            "url": "https://github.com/carlomigueldy/stardew-valley-clone/issues/8",
            "state": "open"
          },
          "depends_on": [
            "LOOP-001"
          ],
          "paths_allowed": [
            "src/**"
          ],
          "acceptance_criteria": [
            "Player can target an adjacent tile.",
            "Tool actions update tile state deterministically.",
            "Invalid tile actions provide clear feedback."
          ]
        },
        {
          "id": "FARM-002",
          "title": "Crop lifecycle vertical slice",
          "type": "feature",
          "status": "done",
          "labels": [
            "farming",
            "crops"
          ],
          "github_issue": {
            "number": 9,
            "url": "https://github.com/carlomigueldy/stardew-valley-clone/issues/9",
            "state": "open"
          },
          "depends_on": [
            "FARM-001",
            "LOOP-002"
          ],
          "paths_allowed": [
            "src/**",
            "public/assets/**"
          ],
          "acceptance_criteria": [
            "Seeds can be planted in prepared soil.",
            "Watered crops advance growth on day transition.",
            "Mature crops can be harvested into inventory."
          ]
        }
      ]
    },
    {
      "id": "EPIC-INVENTORY",
      "title": "Inventory, tools, and items",
      "status": "done",
      "labels": [
        "epic",
        "inventory"
      ],
      "github_issue": {
        "number": 10,
        "url": "https://github.com/carlomigueldy/stardew-valley-clone/issues/10",
        "state": "open"
      },
      "description": "Track tools, seeds, crops, and simple item quantities for the vertical slice.",
      "sub_issues": [
        {
          "id": "INV-001",
          "title": "Hotbar and selected tool state",
          "type": "feature",
          "status": "done",
          "labels": [
            "inventory",
            "ui"
          ],
          "github_issue": {
            "number": 11,
            "url": "https://github.com/carlomigueldy/stardew-valley-clone/issues/11",
            "state": "open"
          },
          "depends_on": [
            "FOUND-001"
          ],
          "paths_allowed": [
            "src/**"
          ],
          "acceptance_criteria": [
            "Hotbar renders the starting tools and seed stack.",
            "Number keys update selected slot.",
            "Selected slot drives interaction behavior."
          ]
        },
        {
          "id": "INV-002",
          "title": "Item stack mutations",
          "type": "feature",
          "status": "done",
          "labels": [
            "inventory",
            "items"
          ],
          "github_issue": {
            "number": 12,
            "url": "https://github.com/carlomigueldy/stardew-valley-clone/issues/12",
            "state": "open"
          },
          "depends_on": [
            "INV-001",
            "FARM-002"
          ],
          "paths_allowed": [
            "src/**"
          ],
          "acceptance_criteria": [
            "Planting consumes one seed from the selected stack.",
            "Harvesting adds crop items to inventory.",
            "Empty stacks cannot trigger item actions."
          ]
        }
      ]
    },
    {
      "id": "EPIC-PERSISTENCE",
      "title": "Local save and restore",
      "status": "planned",
      "labels": [
        "epic",
        "persistence"
      ],
      "github_issue": {
        "number": 13,
        "url": "https://github.com/carlomigueldy/stardew-valley-clone/issues/13",
        "state": "open"
      },
      "description": "Persist the vertical slice state locally so a player can leave and return.",
      "sub_issues": [
        {
          "id": "SAVE-001",
          "title": "Serialize day, farm, player, and inventory state",
          "type": "feature",
          "status": "planned",
          "labels": [
            "persistence",
            "save"
          ],
          "github_issue": {
            "number": 14,
            "url": "https://github.com/carlomigueldy/stardew-valley-clone/issues/14",
            "state": "open"
          },
          "depends_on": [
            "FARM-002",
            "INV-002"
          ],
          "paths_allowed": [
            "src/**"
          ],
          "acceptance_criteria": [
            "Save payload contains version, day, time, farm tiles, player position, and inventory.",
            "Reloading restores the same visible state.",
            "Unknown or incompatible save versions fail safely."
          ]
        }
      ]